{
    "v": 1,
    "sdk": { "name": "vulqen-symfony", "version": "0.4.0" },
    "sent_at": "2026-10-08T12:22:01.123Z",
    "environment": "preprod-eu_2",
    "items": [
        {
            "type": "transaction",
            "id": "01926b3a-7c2e-7a1b-8f3e-1c2d3e4f5a7d",
            "trace_id": "4bf92f3577b34da6a3ce929d0e0e4736",
            "span_id": "00f067aa0ba902b7",
            "name": "app_order_list",
            "op": "http.server",
            "started_at": "2026-10-08T12:22:01.001Z",
            "duration_ms": 41,
            "outcome": "ok",
            "http_status": 200
        }
    ]
}
