{
    "v": 1,
    "sdk": { "name": "vulqen-symfony", "version": "0.2.0" },
    "sent_at": "2026-10-08T12:22:10.000Z",
    "environment": "prod",
    "items": [
        {
            "type": "transaction",
            "id": "01926b3a-7c2e-7a1b-8f3e-1c2d3e4f5a6b",
            "trace_id": "4bf92f3577b34da6a3ce929d0e0e4736",
            "span_id": "00f067aa0ba902b7",
            "parent_span_id": "0af7651916cd43dd",
            "name": "App\\Message\\SendInvoice",
            "op": "queue.process",
            "started_at": "2026-10-08T12:22:01.001Z",
            "duration_ms": 40,
            "outcome": "ok",
            "http.request.body": "order=15"
        },
        {
            "type": "stats",
            "id": "01926b3a-7c2e-7a1b-8f3e-1c2d3e4f5a6d",
            "period_start": "2026-10-08T12:22:00.000Z",
            "period_end": "2026-10-08T12:22:10.000Z",
            "transactions": [
                {
                    "name": "app_order_show",
                    "op": "http.server",
                    "outcome": "ok",
                    "count": 100,
                    "duration_ms_sum": 18240.5,
                    "buckets": [0, 1, 4, 20, 70, 5, 0, 0, 0, 0]
                }
            ]
        }
    ]
}
